ticker,date,title,description,content,source,url,cleaned_text,sentiment_score,sentiment_category
NVDA,2024-09-28 09:22:00+00:00,Why China stocks are now a buy for U.S. investors,"Unusual action for the S 500, a hot bond market and interviews with acting HUD secretary and AT’s chief operating officer","On Tuesday, Peoples Bank of China Gov. Pan Gongsheng announced a slew of stimulus measures that one economist called that central banks most significant stimulus move since the Covid-19 pandemic. The… [+4931 chars]","{'id': None, 'name': 'Yahoo Entertainment'}",https://finance.yahoo.com/news/why-china-stocks-now-buy-092200069.html/,why china stocks are now a buy for us investors unusual action for the s  a hot bond market and interviews with acting hud secretary and ats chief operating officer,0.1375,Positive
NVDA,2024-09-30 13:48:46+00:00,"Dow Jones Falls Ahead Of Powell Speech; Nvidia Falls, Tesla Reverses Higher","Nvidia and Tesla led the stock market lower Monday morning,","The Dow Jones Industrial Average and the other major stock indexes dropped Monday, as Wall Street awaited an afternoon speech from Federal Reserve Chairman Jerome Powell. Early movers on the stock ma… [+5736 chars]","{'id': None, 'name': ""Investor's Business Daily""}",https://www.investors.com/market-trend/stock-market-today/dow-jones-sp500-nasdaq-powell-speech-nvidia-stock-nvda-tsla/,dow jones falls ahead of powell speech nvidia falls tesla reverses higher nvidia and tesla led the stock market lower monday morning,0.25,Positive
TSLA,2024-09-19 11:15:00+00:00,1 Solid AI Stock That's Not Nvidia or Palantir to Focus On in the Next Few Years,This AI company could reach trillions of dollars in market capitalization.,"Artificial intelligence (AI) is probably one of the biggest trends that will change our daily lives in the coming decades. While AI is still in its early development stage, companies like Nvidia and … [+5665 chars]","{'id': None, 'name': 'Yahoo Entertainment'}",https://finance.yahoo.com/news/1-solid-ai-stock-thats-111500631.html/, solid ai stock thats not nvidia or palantir to focus on in the next few years this ai company could reach trillions of dollars in market capitalization,-0.06666666666666667,Negative
TSLA,2024-10-03 20:26:28+00:00,"Tesla stock slips on debt sale, Cybertruck recall reports","Tesla (TSLA) shares are tumbling on Thursday as multiple reports weigh on the electric vehicle maker's stock. According to Bloomberg, the company is planning...","Tesla (TSLA) shares are tumbling on Thursday as multiple reports weigh on the electric vehicle maker's stock. According to Bloomberg, the company is planning a $783 million debt sale, a move that has… [+791 chars]","{'id': None, 'name': 'Yahoo Entertainment'}",https://finance.yahoo.com/video/tesla-stock-slips-debt-sale-202628218.html/,tesla stock slips on debt sale cybertruck recall reports tesla tsla shares are tumbling on thursday as multiple reports weigh on the electric vehicle makers stock according to bloomberg the company is planning,0.0,Neutral
TSLA,2024-10-02 13:40:00+00:00,The Dow drops amid Tesla's delivery report and oil price hike,The Dow and S&P were lower Wednesday morning as escalating tensions between Israel and Iran pushed crude oil prices higher. West Texas Intermediate and Brent surged nearly 3% in the morning trading.Read more...,"In This Story
The Dow Jones Industrial Average and the S&amp;P 500 edged lower Wednesday morning, as escalating tensions between Israel and Iran pushed crude oil prices higher. West Texas Intermedia… [+1675 chars]","{'id': None, 'name': 'Quartz India'}",https://qz.com/dow-futures-drop-teslas-low-delivery-oil-price-hike-1851662976,the dow drops amid teslas delivery report and oil price hike the dow and sp were lower wednesday morning as escalating tensions between israel and iran pushed crude oil prices higher west texas intermediate and brent surged nearly  in the morning tradingread more,0.037500000000000006,Neutral
TSLA,2024-09-11 12:30:00+00:00,"Bitcoin, Ether, and other crypto stocks fall after Kamala Harris' strong debate performance","Vice President Kamala Harris’ strong performance in Tuesday night’s debate with Former President Donald Trump seems to have won her support from some voters, and sent cryptocurrency stocks down.Read more...","In This Story
Vice President Kamala Harris strong performance in Tuesday nights debate with Former President Donald Trump seems to have won her support from some voters, and sent cryptocurrency stoc… [+2509 chars]","{'id': None, 'name': 'Quartz India'}",https://qz.com/kamala-harris-debate-trump-crypto-stocks-fall-bitcoin-1851645435,bitcoin ether and other crypto stocks fall after kamala harris strong debate performance vice president kamala harris strong performance in tuesday nights debate with former president donald trump seems to have won her support from some voters and sent cryptocurrency stocks downread more,0.24833333333333335,Positive
TSLA,2024-09-12 13:05:00+00:00,WeWork's founder Adam Neuman is refunding investors after his crypto comeback took a tumble,Former WeWork CEO Adam Neumann’s Flowcarbon — a climate tech startup that aimed to put carbon credits on the blockchain — has reportedly started refunding investors after failing to deliver on its promises. Read more...,"In This Story
Former WeWork CEO Adam Neumanns Flowcarbon a climate tech startup that aimed to put carbon credits on the blockchain has reportedly started refunding investors after failing to deliver… [+1865 chars]","{'id': None, 'name': 'Quartz India'}",https://qz.com/adam-neumann-flowcarbon-refunds-carbon-credit-weowork-1851646629,weworks founder adam neuman is refunding investors after his crypto comeback took a tumble former wework ceo adam neumanns flowcarbon  a climate tech startup that aimed to put carbon credits on the blockchain  has reportedly started refunding investors after failing to deliver on its promises read more,0.25,Positive
TSLA,2024-09-12 14:40:00+00:00,A startup named after 'Lord of the Rings' just made a missile that's 30% cheaper than rivals on the market,A defense technology startup named after a legendary sword from The Lord of the Rings just unveiled a new line of missiles that it says are 30% cheaper than anything else on the market. Read more...,"In This Story
A defense technology startup named after a legendary sword from The Lord of the Rings just unveiled a new line of missiles that it says are 30% cheaper than anything else on the market… [+2624 chars]","{'id': None, 'name': 'Quartz India'}",https://qz.com/anduril-autonomous-missiles-lotr-palantir-luckey-thiel-1851646748,a startup named after lord of the rings just made a missile thats  cheaper than rivals on the market a defense technology startup named after a legendary sword from the lord of the rings just unveiled a new line of missiles that it says are  cheaper than anything else on the market read more,0.5454545454545454,Positive
TSLA,2024-09-10 23:01:46+00:00,Lyft CEO keeps it real on his stock price compared to Uber,Lyft CEO David Risher says his company is past the turnaround phase.,"Lyft (LYFT) CEO David Risher says his ride-hailing company is beyond the initial turnaround phase now investors need to take notice.
The company is in a ""different stage"" from when he took over as C… [+3452 chars]","{'id': None, 'name': 'Yahoo Entertainment'}",https://finance.yahoo.com/news/lyft-ceo-keeps-it-real-on-his-stock-price-compared-to-uber-230146967.html,lyft ceo keeps it real on his stock price compared to uber lyft ceo david risher says his company is past the turnaround phase,-0.024999999999999994,Neutral
TSLA,2024-09-30 11:00:45+00:00,Musk's Trump Card: Will Tesla Be Boosted Or Totaled?,"Republicans, on the other hand, generally oppose government subsidies for EVs and renewable energy, favoring a free-market approach.","CHENGDU, CHINA - SEPTEMBER 28: Two women walk past the Tesla storefront on September 28, 2024, in ... [+] Chengdu, China. Tesla continues to expand its presence in China, showcasing its electric vehi… [+7184 chars]","{'id': None, 'name': 'Forbes'}",https://www.forbes.com/sites/greatspeculations/2024/09/30/teslas-trump/,musks trump card will tesla be boosted or totaled republicans on the other hand generally oppose government subsidies for evs and renewable energy favoring a freemarket approach,-0.03749999999999999,Neutral
TSLA,2024-09-17 12:00:30+00:00,Monster Beverage Stock Vs. Keurig Dr Pepper,"There is more to the comparison, and in the sections below, we discuss why we think MNST will outperform KDP in the next three years.","Monster cans are seen at the airport in Balice near Krakow, Poland on May 18, 2024. (Photo by Jakub ... [+] Porzycki/NurPhoto via Getty Images)
NurPhoto via Getty Images
We believe that Monster Bev… [+5846 chars]","{'id': None, 'name': 'Forbes'}",https://www.forbes.com/sites/greatspeculations/2024/09/17/monster-beverage-stock-vs-keurig-dr-pepper/,monster beverage stock vs keurig dr pepper there is more to the comparison and in the sections below we discuss why we think mnst will outperform kdp in the next three years,0.25,Positive
TSLA,2024-09-11 21:11:15+00:00,5 Top Stocks To Buy In October,Looking for the latest stock opportunities in October 2024? We have you covered. Click to read about top stock picks to consider adding to your portfolio now.,"getty
As October approaches and the stock market unfolds its complexities and possibilities for investors, this article takes a look at stock picks in today's market scene based on financial perform… [+17276 chars]","{'id': None, 'name': 'Forbes'}",https://www.forbes.com/sites/investor-hub/article/best-stocks-buy-now-october-2024/, top stocks to buy in october looking for the latest stock opportunities in october  we have you covered click to read about top stock picks to consider adding to your portfolio now,0.5,Positive
TSLA,2024-09-26 11:00:19+00:00,Bristol Myers Squibb Vs. AbbVie Stock,"Given its better valuation, we believe that Bristol Myers Squibb stock (NYSE: BMY) is currently a better pick than its peer – AbbVie stock .","GERMANY - 2024/03/03: In this photo illustration, the Bristol-Myers Squibb Company logo is seen ... [+] displayed on a tablet. (Photo Illustration by Igor Golovniov/SOPA Images/LightRocket via Getty … [+6698 chars]","{'id': None, 'name': 'Forbes'}",https://www.forbes.com/sites/greatspeculations/2024/09/26/bristol-myers-squibb-vs-abbvie-stock/,bristol myers squibb vs abbvie stock given its better valuation we believe that bristol myers squibb stock nyse bmy is currently a better pick than its peer  abbvie stock ,0.5,Positive
TSLA,2024-09-17 11:00:07+00:00,Pick Disney Over Johnson & Johnson Stock,"There is more to the comparison, and in the sections below, we discuss why we think Disney will outperform J&J in the next three years.","CHINA - 2022/07/25: In this photo illustration, the American multinational medical devices and ... [+] pharmaceutical company Johnson &amp; Johnson (J&amp;J) logo is displayed on a smartphone screen.… [+7187 chars]","{'id': None, 'name': 'Forbes'}",https://www.forbes.com/sites/greatspeculations/2024/09/17/pick-disney-over-johnson--johnson-stock/,pick disney over johnson  johnson stock there is more to the comparison and in the sections below we discuss why we think disney will outperform jj in the next three years,0.25,Positive
TSLA,2024-09-10 13:30:15+00:00,Pick CSX Over Norfolk Southern Stock?,"Given its better valuation and prospects, we think CSX stock (NYSE: CSX) is a better pick than its peer – Norfolk Southern stock (NYSE: NSC).","ATLANTA, GA - APRIL 01: A general view of the exterior of the headquarters of Norfolk Southern on ... [+] April 1, 2023 in Atlanta, Georgia. The US Justice Department filed a civil lawsuit on March 3… [+6336 chars]","{'id': None, 'name': 'Forbes'}",https://www.forbes.com/sites/greatspeculations/2024/09/10/pick-csx-over-norfolk-southern-stock/,pick csx over norfolk southern stock given its better valuation and prospects we think csx stock nyse csx is a better pick than its peer  norfolk southern stock nyse nsc,0.25,Positive
TSLA,2024-09-10 10:30:21+00:00,nVidia vs. SMCI,"We compare a slew of factors, such as historical revenue growth, stock returns, and valuation.","SHANGHAI, CHINA - SEPTEMBER 5, 2024 - The NVIDIA pavilion at the Bund Conference in Shanghai, China, ... [+] September 5, 2024. (Photo credit should read CFOTO/Future Publishing via Getty Images)
CF… [+6663 chars]","{'id': None, 'name': 'Forbes'}",https://www.forbes.com/sites/greatspeculations/2024/09/10/nvidia-vs-smci/,nvidia vs smci we compare a slew of factors such as historical revenue growth stock returns and valuation,0.0,Neutral
TSLA,2024-09-13 10:00:46+00:00,Pfizer Stock Vs. AbbVie,"Although Pfizer has seen better revenue growth in recent years, AbbVie is more profitable.","Blister packets each containing a dose of PAXLOVID prescription medicine for a patient's Covid-19 ... [+] viral infection are arranged for a photo illustration on September 4, 2024 in Los Angeles, Ca… [+6451 chars]","{'id': None, 'name': 'Forbes'}",https://www.forbes.com/sites/greatspeculations/2024/09/13/is-pfizer-stock-a-better-pick-over-abbvie/,pfizer stock vs abbvie although pfizer has seen better revenue growth in recent years abbvie is more profitable,0.3333333333333333,Positive
TSLA,2024-09-29 11:00:00+00:00,Are Stocks Overvalued?,Expected Fed rate cuts and resilient economic growth sent stocks to all-time highs. Above-average stock valuation in light of fundamentals and the outlook are explored.,"With the backdrop of further expected Fed rate cuts, resilient economic growth, and stocks closing ... [+] at highs last week, are stocks overvalued?
getty
Chair Powell and the Federal Reserve rece… [+8294 chars]","{'id': None, 'name': 'Forbes'}",https://www.forbes.com/sites/bill_stone/2024/09/29/are-stocks-overvalued/,are stocks overvalued expected fed rate cuts and resilient economic growth sent stocks to alltime highs aboveaverage stock valuation in light of fundamentals and the outlook are explored,0.16666666666666666,Positive
TSLA,2024-09-19 19:42:36+00:00,"Why Tesla, Toyota, and Indie Semiconductor Rallied Today","Shares of auto leaders Tesla (NASDAQ: TSLA) and Toyota Motor (NYSE: TM), as well as auto-centered semiconductor stock Indie Semiconductor (NASDAQ: INDI) were rallying on Thursday, up 7.3%, 4.3%, and 3.5%, respectively, as of 2:14 p.m. ET.
The main driver for …","Shares of auto leaders Tesla (NASDAQ: TSLA) and Toyota Motor (NYSE: TM), as well as auto-centered semiconductor stock Indie Semiconductor (NASDAQ: INDI) were rallying on Thursday, up 7.3%, 4.3%, and … [+127 chars]","{'id': None, 'name': 'Biztoc.com'}",https://biztoc.com/x/c701f4d9afe1a78b,"why tesla toyota and indie semiconductor rallied today shares of auto leaders tesla nasdaq tsla and toyota motor nyse tm as well as autocentered semiconductor stock indie semiconductor nasdaq indi were rallying on thursday up   and  respectively as of  pm et
the main driver for ",0.041666666666666664,Neutral
TSLA,2024-10-01 11:03:56+00:00,Success of China EVs Challenges Tesla,"24/7 Wall St. Insights
Tesla Inc. (NASDAQ: TSLA) faces fierce competition for market share in China.
Will its powerful brand be enough to sustain it there?
Also: Dividend legends to hold forever.
China electric vehicle (EV) companies have started to release t…",24/7 Wall St. InsightsTesla Inc. (NASDAQ: TSLA) faces fierce competition for market share in China.Will its powerful brand be enough to sustain it there?Also: Dividend legends to hold forever.China e… [+129 chars],"{'id': None, 'name': 'Biztoc.com'}",https://biztoc.com/x/ebf4767f16402616,"success of china evs challenges tesla  wall st insights
tesla inc nasdaq tsla faces fierce competition for market share in china
will its powerful brand be enough to sustain it there
also dividend legends to hold forever
china electric vehicle ev companies have started to release t",0.19999999999999998,Positive
TSLA,2024-09-17 14:28:09+00:00,"Market Clubhouse Morning Memo - September 17th, 2024 (Trade Strategy For SPY, QQQ, AAPL, MSFT, NVDA, GOOGL, META And TSLA)","Good Morning Traders! In today's Market Clubhouse Morning Memo, we will discuss SPY, QQQ, AAPL, MSFT, NVDA, GOOGL, META, and TSLA.
Our proprietary formula, exclusive to Market Clubhouse, dictates these price levels. This dynamic equation takes into account pr…","Good Morning Traders! In today's Market Clubhouse Morning Memo, we will discuss SPY, QQQ, AAPL, MSFT, NVDA, GOOGL, META, and TSLA.Our proprietary formula, exclusive to Market Clubhouse, dictates thes… [+132 chars]","{'id': None, 'name': 'Biztoc.com'}",https://biztoc.com/x/b352e0172af76865,"market clubhouse morning memo  september th  trade strategy for spy qqq aapl msft nvda googl meta and tsla good morning traders in todays market clubhouse morning memo we will discuss spy qqq aapl msft nvda googl meta and tsla
our proprietary formula exclusive to market clubhouse dictates these price levels this dynamic equation takes into account pr",0.35,Positive
TSLA,2024-09-12 15:14:40+00:00,"Market Clubhouse Morning Memo - September 12th, 2024 (Trade Strategy For SPY, QQQ, AAPL, MSFT, NVDA, GOOGL, META And TSLA)","Good Morning Traders! In today's Market Clubhouse Morning Memo, we will discuss SPY, QQQ, AAPL, MSFT, NVDA, GOOGL, META, and TSLA.
Our proprietary formula, exclusive to Market Clubhouse, dictates these price levels. This dynamic equation takes into account pr…","Good Morning Traders! In today's Market Clubhouse Morning Memo, we will discuss SPY, QQQ, AAPL, MSFT, NVDA, GOOGL, META, and TSLA.Our proprietary formula, exclusive to Market Clubhouse, dictates thes… [+132 chars]","{'id': None, 'name': 'Biztoc.com'}",https://biztoc.com/x/57af4c5c88f0ca04,"market clubhouse morning memo  september th  trade strategy for spy qqq aapl msft nvda googl meta and tsla good morning traders in todays market clubhouse morning memo we will discuss spy qqq aapl msft nvda googl meta and tsla
our proprietary formula exclusive to market clubhouse dictates these price levels this dynamic equation takes into account pr",0.35,Positive
TSLA,2024-09-26 16:32:59+00:00,"Market Clubhouse Morning Memo - September 26th, 2024 (Trade Strategy For SPY, QQQ, AAPL, MSFT, NVDA, GOOGL, META And TSLA)","Good Morning Traders! In today's Market Clubhouse Morning Memo, we will discuss SPY, QQQ, AAPL, MSFT, NVDA, GOOGL, META, and TSLA.
Our proprietary formula, exclusive to Market Clubhouse, dictates these price levels. This dynamic equation takes into account pr…","Good Morning Traders! In today's Market Clubhouse Morning Memo, we will discuss SPY, QQQ, AAPL, MSFT, NVDA, GOOGL, META, and TSLA.Our proprietary formula, exclusive to Market Clubhouse, dictates thes… [+132 chars]","{'id': None, 'name': 'Biztoc.com'}",https://biztoc.com/x/6d3508733fe05dfd,"market clubhouse morning memo  september th  trade strategy for spy qqq aapl msft nvda googl meta and tsla good morning traders in todays market clubhouse morning memo we will discuss spy qqq aapl msft nvda googl meta and tsla
our proprietary formula exclusive to market clubhouse dictates these price levels this dynamic equation takes into account pr",0.35,Positive
TSLA,2024-09-12 20:12:06+00:00,Tesla's Robotaxi Is Coming. Here's What You Need To Know.,Tesla stock is meeting resistance in the runup to the robotaxi event.,"Tesla (TSLA) is scheduled to reveal its highly anticipated robotaxi on Oct. 10 at an event in Los Angeles, California, and investors appear to be waiting until then before making any big Tesla stock … [+4123 chars]","{'id': None, 'name': ""Investor's Business Daily""}",https://www.investors.com/news/tesla-stock-robotaxi-event-upcoming-what-you-need-to-know/,teslas robotaxi is coming heres what you need to know tesla stock is meeting resistance in the runup to the robotaxi event,0.0,Neutral
TSLA,2024-09-09 13:40:29+00:00,Tesla China Sales Roar Back In August. Elon Musk Says This About The Shanghai Plant.,Tesla stock cratered on Friday but looked to gain ground early Monday.,"Tesla (TSLA) domestic sales in China hit 2024 year highs last month, marking a 37% increase compared to July, according to data released Monday by the China Passenger Car Association. Meanwhile Chief… [+3794 chars]","{'id': None, 'name': ""Investor's Business Daily""}",https://www.investors.com/news/tesla-stock-china-sales-elon-musk-shanghai-plant/,tesla china sales roar back in august elon musk says this about the shanghai plant tesla stock cratered on friday but looked to gain ground early monday,0.05,Neutral
TSLA,2024-09-05 13:49:38+00:00,"Stock market today: S&P 500, Nasdaq climb amid more soft jobs market data",Labor data is in focus as the prospect of rate cuts fails to offset growing doubts about the health of the economy.,"US stocks gained on Thursday as investors digested more weaker-than-expected labor market data that could help set expectations for both interest rate cut hopes and the health of the US economy.
The… [+3340 chars]","{'id': None, 'name': 'Yahoo Entertainment'}",https://finance.yahoo.com/news/live/stock-market-today-sp-500-nasdaq-climb-amid-more-soft-jobs-market-data-134938220.html,stock market today sp  nasdaq climb amid more soft jobs market data labor data is in focus as the prospect of rate cuts fails to offset growing doubts about the health of the economy,0.033333333333333326,Neutral
TSLA,2024-10-02 14:12:12+00:00,Tesla drops 5% after Q3 deliveries fall short of estimates,"Tesla is poised to deliver third quarter deliveries this week, a result that could push the stock beyond the strong recent gains it has already seen.","Tesla (TSLA) announced third quarter deliveries on Wednesday that missed expectations, sending the stock down more than 5% in early trading.
The EV maker delivered 462,890 vehicles in the three mont… [+1268 chars]","{'id': None, 'name': 'Yahoo Entertainment'}",https://finance.yahoo.com/news/tesla-stock-drops-5-after-q3-deliveries-fall-short-of-estimates-141212969.html/,tesla drops  after q deliveries fall short of estimates tesla is poised to deliver third quarter deliveries this week a result that could push the stock beyond the strong recent gains it has already seen,0.10833333333333334,Positive
TSLA,2024-10-01 10:58:44+00:00,Technical Assessment: Bullish in the Intermediate-Term,"Find the latest MarketAxess Holdings, Inc. (MKTX) stock forecast based on top analyst's estimates, plus more investing and trading data from Yahoo Finance","Most stock indices didn't rock the world in September, but any progress in that historically difficult month should be considered a bonus -- especially after the gains already booked so far in 2024. … [+1173 chars]","{'id': None, 'name': 'Yahoo Entertainment'}",https://finance.yahoo.com/research/reports/ARGUS_41379_TechnicalAnalysis_1727780324000/,technical assessment bullish in the intermediateterm find the latest marketaxess holdings inc mktx stock forecast based on top analysts estimates plus more investing and trading data from yahoo finance,0.375,Positive
TSLA,2024-09-18 20:59:16+00:00,Dow Jones Futures: Stock Market Reverses Lower Despite Big Fed Rate Cut; What To Do Now,The Dow Jones and S&P 500 initially hit record highs on the Fed move.,"Dow Jones futures rose slightly after hours, along with S&amp;P 500 futures and Nasdaq futures after volatile market action following the Federal Reserve rate cut.
The stock market initially jumped … [+6612 chars]","{'id': None, 'name': ""Investor's Business Daily""}",https://www.investors.com/market-trend/stock-market-today/dow-jones-futures-stock-market-lower-fed-rate-cut/,dow jones futures stock market reverses lower despite big fed rate cut what to do now the dow jones and sp  initially hit record highs on the fed move,0.0,Neutral
TSLA,2024-09-24 22:23:02+00:00,"Dow Jones Futures: Nvidia, Tesla Rival Jump Into Buy Areas With Stock Market At Bullish Levels","The S&P 500 set a closing high while the Nasdaq topped 18,000 again.","Dow Jones futures were little changed after hours, along with S&amp;P 500 futures and Nasdaq futures. KB Home (KBH) reported after the close.
The stock market rally enjoyed modest gains on Wednesday… [+7089 chars]","{'id': None, 'name': ""Investor's Business Daily""}",https://www.investors.com/market-trend/stock-market-today/dow-jones-futures-nvidia-tesla-rival-jump-buy-areas-bullishlevels/,dow jones futures nvidia tesla rival jump into buy areas with stock market at bullish levels the sp  set a closing high while the nasdaq topped  again,0.16,Positive
TSLA,2024-10-01 23:29:47+00:00,Dow Jones Futures Fall After Stocks Hold Key Levels Following Iran Attack; Tesla Deliveries Due,"The Nasdaq slumped 1.5%, but did find key support.","Dow Jones futures fell modestly after hours, along with S&amp;P 500 futures and Nasdaq futures. Nike (NKE) reported earnings Tuesday night with Tesla deliveries on tap before the open.
The stock mar… [+7360 chars]","{'id': None, 'name': ""Investor's Business Daily""}",https://www.investors.com/market-trend/stock-market-today/dow-jones-futures-market-pares-losses-iran-missile-attack-tesla-deliveries/,dow jones futures fall after stocks hold key levels following iran attack tesla deliveries due the nasdaq slumped  but did find key support,-0.03125,Neutral
