ticker,date,title,description,content,source,url,cleaned_text,sentiment_score,sentiment_category
NVDA,2024-09-09 18:45:00+00:00,"NVIDIA Wipes Out $400B in Value: Buy, Hold, or Sell NVDA Stock?","NVIDIA's shares lately took a beating as regulators launched a probe into the company's contracts. Is it the right time to sell the NVDA stock, or will...",NVIDIA Corporation NVDA witnessed a meteoric rise over the past few years due to the advent of artificial intelligence (AI). Its recent share repurchase has installed confidence among investors and t… [+5279 chars],"{'id': None, 'name': 'Yahoo Entertainment'}",https://finance.yahoo.com/news/nvidia-wipes-400b-value-buy-184500618.html,nvidia wipes out b in value buy hold or sell nvda stock nvidias shares lately took a beating as regulators launched a probe into the companys contracts is it the right time to sell the nvda stock or will,-0.007142857142857145,Neutral
NVDA,2024-09-16 21:14:15+00:00,NVIDIA Corporation (NVDA) a Good Big Tech Stock to Buy Now?,"We recently compiled a list of the 13 Best Big Tech Stocks To Buy Now. In this article, we are going to take a look at where NVIDIA Corporation (NASDAQ:NVDA)...","We recently compiled a list of the 13 Best Big Tech Stocks To Buy Now. In this article, we are going to take a look at where NVIDIA Corporation (NASDAQ:NVDA) stands against the other big tech stocks.… [+5323 chars]","{'id': None, 'name': 'Yahoo Entertainment'}",https://finance.yahoo.com/news/nvidia-corporation-nvda-good-big-211415800.html,nvidia corporation nvda a good big tech stock to buy now we recently compiled a list of the  best big tech stocks to buy now in this article we are going to take a look at where nvidia corporation nasdaqnvda,0.33999999999999997,Positive
NVDA,2024-09-21 08:33:00+00:00,"Move Over, Nvidia: Billionaires Are Selling Its Shares and Buying Up These 2 Artificial Intelligence (AI) Stocks Instead",Many billionaires are shifting some of their AI investments toward Super Micro Computer and Microsoft.,"Wall Street has fallen in love with the artificial intelligence (AI) trend. This is not surprising, considering that PwC analysts expect AI to add nearly $15.7 trillion to the global economy annually… [+7436 chars]","{'id': None, 'name': 'Yahoo Entertainment'}",https://finance.yahoo.com/news/move-over-nvidia-billionaires-selling-083300873.html/,move over nvidia billionaires are selling its shares and buying up these  artificial intelligence ai stocks instead many billionaires are shifting some of their ai investments toward super micro computer and microsoft,0.07777777777777778,Positive
NVDA,2024-09-26 12:25:00+00:00,Nvidia is back in the $3 trillion club — and Jensen Huang is $2 billion richer,Nvidia (NVDA) chief executive Jensen Huang is $2.3 billion richer thanks to a recent bump in Nvidia stock.Read more...,"In This Story
Nvidia (NVDA) chief executive Jensen Huang is $2.3 billion richer thanks to a recent bump in Nvidia stock.
Shares of the chip giant were up more than 2% in pre-market trading, after c… [+2041 chars]","{'id': None, 'name': 'Quartz India'}",https://qz.com/nvidia-huang-stock-market-cap-3-trillion-club-1851658116,nvidia is back in the  trillion club  and jensen huang is  billion richer nvidia nvda chief executive jensen huang is  billion richer thanks to a recent bump in nvidia stockread more,0.175,Positive
NVDA,2024-10-03 17:41:00+00:00,Nvidia stock rises after Jensen Huang says demand for its new AI chips is 'insane',"Nvidia’s (NVDA) next-generation artificial intelligence chip is in full production, and demand for it is “insane,” according to CEO Jensen Huang.Read more...","In This Story
Nvidias (NVDA) next-generation artificial intelligence chip is in full production, and demand for it is insane, according to CEO Jensen Huang.
Everybody wants to have the most, and ev… [+1709 chars]","{'id': None, 'name': 'Quartz India'}",https://qz.com/nvidia-stock-jensen-huang-demand-ai-chip-blackwell-1851664485,nvidia stock rises after jensen huang says demand for its new ai chips is insane nvidias nvda nextgeneration artificial intelligence chip is in full production and demand for it is insane according to ceo jensen huangread more,-0.268939393939394,Negative
NVDA,2024-09-25 17:03:30+00:00,Nvidia stock is stuck in a rut. But it's still up huge for the year,"Ever since shares of Nvidia (NVDA) reached an all-time high in June, the chipmaker’s stock has experienced some turbulence — but its market cap is still up over 150% so far this year.Read more...","In This Story
Ever since shares of Nvidia (NVDA) reached an all-time high in June, the chipmakers stock has experiencedsometurbulence but its market cap is still up over 150% so far this year.
Nvid… [+1613 chars]","{'id': None, 'name': 'Quartz India'}",https://qz.com/nvidia-stock-down-summer-high-market-cap-3-trillion-1851657249,nvidia stock is stuck in a rut but its still up huge for the year ever since shares of nvidia nvda reached an alltime high in june the chipmakers stock has experienced some turbulence  but its market cap is still up over  so far this yearread more,0.392,Positive
NVDA,2024-09-30 14:35:00+00:00,Super Micro Computer's big stock split is today. Here’s what to know,"Super Micro Computer (SMCI) is set to undergo a stock split after the market closes on Monday, aligning itself with other prominent AI-driven companies like Nvidia and Broadcom, which also executed stock splits earlier this year. Following the split, the stoc…","In This Story
Super Micro Computer (SMCI) is set to undergo a stock split after the market closes on Monday, aligning itself with other prominent AI-driven companies like Nvidia and Broadcom, which … [+1774 chars]","{'id': None, 'name': 'Quartz India'}",https://qz.com/super-micro-computer-stock-split-1851660648,super micro computers big stock split is today heres what to know super micro computer smci is set to undergo a stock split after the market closes on monday aligning itself with other prominent aidriven companies like nvidia and broadcom which also executed stock splits earlier this year following the split the stoc,0.14880952380952378,Positive
NVDA,2024-09-16 13:00:00+00:00,"Nvidia, Microsoft, and other tech stocks could rally after the Fed cuts interest rates","With the Federal Reserve set to begin cutting interest rates this week, analysts believe tech stocks could get a big boost.Read more...","In This Story
With the Federal Reserve set to begin cutting interest rates this week, analysts believe tech stocks could get a big boost.
The start of a rate cutting cycle will be a positive signal… [+2363 chars]","{'id': None, 'name': 'Quartz India'}",https://qz.com/tech-stocks-nvidia-microsoft-ai-artificial-intelligence-1851648810,nvidia microsoft and other tech stocks could rally after the fed cuts interest rates with the federal reserve set to begin cutting interest rates this week analysts believe tech stocks could get a big boostread more,-0.056249999999999994,Negative
NVDA,2024-09-23 12:12:00+00:00,Intel is having a brutal year — but suddenly everybody wants a piece of it,Intel (INTC) is reportedly in talks for two multi-billion dollar deals — including a takeover — as the struggling chipmaker continues to draw interest from investors.Read more...,"In This Story
Intel (INTC) is reportedly in talks for two multi-billion dollar deals including a takeover as the struggling chipmaker continues to draw interest from investors.
Bloomberg, citing un… [+2217 chars]","{'id': None, 'name': 'Quartz India'}",https://qz.com/intel-qualcomm-apollo-nvidia-ai-chips-1851654625,intel is having a brutal year  but suddenly everybody wants a piece of it intel intc is reportedly in talks for two multibillion dollar deals  including a takeover  as the struggling chipmaker continues to draw interest from investorsread more,-0.04375000000000001,Neutral
NVDA,2024-09-23 18:42:00+00:00,"Intel needs Qualcomm, but it's not a two-way street, analysts say","After missing second-quarter earnings expectations and seeing its stock fall over 50% so far this year, Intel (INTC) is still attracting interest worth billions of dollars.Read more...","In This Story
After missing second-quarter earnings expectations and seeing its stock fall over 50% so far this year, Intel (INTC) is still attracting interest worth billions of dollars.
Chipmaker … [+4478 chars]","{'id': None, 'name': 'Quartz India'}",https://qz.com/qualcomm-wouldnt-benefit-much-takeover-intel-chips-ai-1851654828,intel needs qualcomm but its not a twoway street analysts say after missing secondquarter earnings expectations and seeing its stock fall over  so far this year intel intc is still attracting interest worth billions of dollarsread more,0.175,Positive
NVDA,2024-09-24 20:32:08+00:00,"Nvidia stock's 20% drop is actually a good sign for the market, strategist says. Here's why","Tony Roth, chief investment officer for Wilmington Trust Investment Advisors, spoke with Quartz for the latest installment of our “Smart Investing” video series.Read more...","In This Story
Tony Roth, chief investment officer for Wilmington Trust Investment Advisors, spoke with Quartz for the latest installment of our Smart Investing video series.
Watch the interview abo… [+4661 chars]","{'id': None, 'name': 'Quartz India'}",https://qz.com/2025-market-nvidia-tony-roth-wilmington-trust-1851656473,nvidia stocks  drop is actually a good sign for the market strategist says heres why tony roth chief investment officer for wilmington trust investment advisors spoke with quartz for the latest installment of our smart investing video seriesread more,0.47857142857142854,Positive
NVDA,2024-09-09 22:36:46+00:00,Intel faces 'uphill battle' as its stock hovers near record lows: Goldman Sachs analyst,"The inflection point for Intel can't be seen just yet, says Goldman Sachs.","The road ahead for struggling Intel (INTC) is uncertain at best as its stock hovers near record lows.
Intel faces an ""uphill battle"" to turn itself around and compete with the likes of Nvidia (NVDA)… [+3050 chars]","{'id': None, 'name': 'Yahoo Entertainment'}",https://finance.yahoo.com/news/intel-faces-uphill-battle-as-its-stock-hovers-near-record-lows-goldman-sachs-analyst-223646226.html,intel faces uphill battle as its stock hovers near record lows goldman sachs analyst the inflection point for intel cant be seen just yet says goldman sachs,0.1,Positive
NVDA,2024-09-06 18:38:34+00:00,My Secret Weapon For Calling The Top In NVDA,"While everyone else was cheering Nvidia’s (NVDA) stock back to new heights this week, I called the top for the stock first thing Monday August 26th.","August 9, 2019 Santa Clara / CA / USA - One of the Nvidia office buildings located in the Company's ... [+] campus in Silicon Valley; the NVIDIA logo and symbol displayed on the facade
getty
While … [+19921 chars]","{'id': None, 'name': 'Forbes'}",https://www.forbes.com/sites/greatspeculations/2024/09/06/my-secret-weapon-for-calling-the-top-in-nvda/,my secret weapon for calling the top in nvda while everyone else was cheering nvidias nvda stock back to new heights this week i called the top for the stock first thing monday august th,0.1643939393939394,Positive
NVDA,2024-09-10 10:30:21+00:00,nVidia vs. SMCI,"We compare a slew of factors, such as historical revenue growth, stock returns, and valuation.","SHANGHAI, CHINA - SEPTEMBER 5, 2024 - The NVIDIA pavilion at the Bund Conference in Shanghai, China, ... [+] September 5, 2024. (Photo credit should read CFOTO/Future Publishing via Getty Images)
CF… [+6663 chars]","{'id': None, 'name': 'Forbes'}",https://www.forbes.com/sites/greatspeculations/2024/09/10/nvidia-vs-smci/,nvidia vs smci we compare a slew of factors such as historical revenue growth stock returns and valuation,0.0,Neutral
NVDA,2024-09-23 18:36:08+00:00,Nvidia Versus AMD: Which AI Stock Is The Better Buy Right Now?,Comparing Nvidia and AMD to decide which to invest in? It can be difficult to analyze everything happening with these AI stocks now. Here's help breaking it down.,"getty
A year ago, there was only Nvidia (NVDA) in the AI race. But now investors are looking at Advanced Micro Devices (AMD) as a potential competitor. Which AI stock should have a place in your por… [+13407 chars]","{'id': None, 'name': 'Forbes'}",https://www.forbes.com/sites/investor-hub/article/nvidia-vs-amd-which-ai-stock-better-buy-now/,nvidia versus amd which ai stock is the better buy right now comparing nvidia and amd to decide which to invest in it can be difficult to analyze everything happening with these ai stocks now heres help breaking it down,0.032539682539682535,Neutral
NVDA,2024-09-26 10:00:51+00:00,Nvidia Stock -- The Road To $200,"Consider this, just about nine months ago, at the end of December 2023, Nvidia stock was trading at around $50 levels.","Visitors check out Nvidia's AI technology at the 2024 Apsara Conference in Hangzhou, China, on ... [+] September 19, 2024. (Photo by Costfoto/NurPhoto via Getty Images)
NurPhoto via Getty Images
Co… [+6080 chars]","{'id': None, 'name': 'Forbes'}",https://www.forbes.com/sites/greatspeculations/2024/09/26/nvidia-stockthe-road-to-200/,nvidia stock  the road to  consider this just about nine months ago at the end of december  nvidia stock was trading at around  levels,0.0,Neutral
NVDA,2024-09-29 11:00:00+00:00,Are Stocks Overvalued?,Expected Fed rate cuts and resilient economic growth sent stocks to all-time highs. Above-average stock valuation in light of fundamentals and the outlook are explored.,"With the backdrop of further expected Fed rate cuts, resilient economic growth, and stocks closing ... [+] at highs last week, are stocks overvalued?
getty
Chair Powell and the Federal Reserve rece… [+8294 chars]","{'id': None, 'name': 'Forbes'}",https://www.forbes.com/sites/bill_stone/2024/09/29/are-stocks-overvalued/,are stocks overvalued expected fed rate cuts and resilient economic growth sent stocks to alltime highs aboveaverage stock valuation in light of fundamentals and the outlook are explored,0.16666666666666666,Positive
NVDA,2024-10-01 14:10:00+00:00,Forget Tech Volatility: ‘Go Global’ With This Steady 8.1% Payer,"Closed-end funds (CEFs), with an average yield of around 8%, are terrific for just about any investor—especially those looking to their portfolios to help pay the bills.","Background of international currency notes.
getty
Closed-end funds (CEFs), with an average yield of around 8%, are terrific for just about any investorespecially those looking to their portfolios t… [+5448 chars]","{'id': None, 'name': 'Forbes'}",https://www.forbes.com/sites/michaelfoster/2024/10/01/forget-tech-volatility-go-global-with-this-steady-81-payer/,forget tech volatility go global with this steady  payer closedend funds cefs with an average yield of around  are terrific for just about any investorespecially those looking to their portfolios to help pay the bills,0.004166666666666666,Neutral
NVDA,2024-09-20 00:29:03+00:00,4 Things Investors Must Know About AI,"The pace of transformation that generative AI is driving is unlike any other technology seen before. Below, I dig into the four things that investors must know about AI.","Last week was quite an important week for tech and AI investors, with Goldman Sachs hosting its Communacopia and Technology Conference featuring executives from the largest tech and semiconductor com… [+14045 chars]","{'id': None, 'name': 'Forbes'}",https://www.forbes.com/sites/bethkindig/2024/09/19/4-things-investors-must-know-about-ai/, things investors must know about ai the pace of transformation that generative ai is driving is unlike any other technology seen before below i dig into the four things that investors must know about ai,-0.125,Negative
NVDA,2024-09-11 21:11:15+00:00,5 Top Stocks To Buy In October,Looking for the latest stock opportunities in October 2024? We have you covered. Click to read about top stock picks to consider adding to your portfolio now.,"getty
As October approaches and the stock market unfolds its complexities and possibilities for investors, this article takes a look at stock picks in today's market scene based on financial perform… [+17276 chars]","{'id': None, 'name': 'Forbes'}",https://www.forbes.com/sites/investor-hub/article/best-stocks-buy-now-october-2024/, top stocks to buy in october looking for the latest stock opportunities in october  we have you covered click to read about top stock picks to consider adding to your portfolio now,0.5,Positive
NVDA,2024-09-30 23:00:33+00:00,Focus On The Data To Avoid Future Bear Traps,The stock market was set up for a bear trap at the start of September and the Viper Report’s Tom Aspray has some suggestions on how to avoid the next trap.,"Bear and bull in a trap. 
getty
The stock market was able to rally last week despite the larger-than-expected 0.50% rate cut by the FOMC. As is often the case the averages gyrated after Fed Chair P… [+5700 chars]","{'id': None, 'name': 'Forbes'}",https://www.forbes.com/sites/tomaspray/2024/09/30/focus-on-the-data-to-avoid-future-bear-traps/,focus on the data to avoid future bear traps the stock market was set up for a bear trap at the start of september and the viper reports tom aspray has some suggestions on how to avoid the next trap,0.0,Neutral
NVDA,2024-09-08 15:32:00+00:00,5 Small Caps Yielding 9%-15%: Hidden Values Or Overlooked Trash?,Select small caps pay serious dividends. I’m talking about yields between 9.1% and 14.7%. But are these value stocks? Or are they merely cheap for a reason?,"Cropped shot of a garbage collection worker
getty
The index huggers are, rightfully, fretting about the only position they own, the S&amp;P 500, which is heavy on Nvidia (NVDA). The soon-to-be-fall… [+8495 chars]","{'id': None, 'name': 'Forbes'}",https://www.forbes.com/sites/brettowens/2024/09/08/5-small-caps-yielding-9-15-hidden-values-or-overlooked-trash/, small caps yielding  hidden values or overlooked trash select small caps pay serious dividends im talking about yields between  and  but are these value stocks or are they merely cheap for a reason,-0.12,Negative
NVDA,2024-09-14 03:38:01+00:00,Inflation Subdued; A Slowing Economy: Will Fed Lower -25 Or -50?,Equity markets were up smartly for the week ended September 13 with three of the four major averages up between 4% and 6% (see table).,"Equity markets were up smartly for the week ended September 13 with three of the four major averages up between 4% and 6% (see table). Only the Dow Jones lagged (+2.60%), mainly for wont of a high co… [+10916 chars]","{'id': None, 'name': 'Forbes'}",https://www.forbes.com/sites/greatspeculations/2024/09/13/inflation-subdued-a-slowing-economy-will-fed-lower25-or50/,inflation subdued a slowing economy will fed lower  or  equity markets were up smartly for the week ended september  with three of the four major averages up between  and  see table,0.13839285714285715,Positive
NVDA,2024-09-09 20:57:44+00:00,Should You Buy These 3 Stocks Before The U.S. Presidential Election?,"Discover whether you should invest in these three stocks before the U.S. presidential election, analyzing potential impacts on the market and your portfolio.","getty
As the battle for the Whitehouse heats up, Harris seems neck and neck with Trump, despite her last-minute wild card entry into the race. Historian Allan Lichtman, often dubbed the Nostradamus""… [+28279 chars]","{'id': None, 'name': 'Forbes'}",https://www.forbes.com/sites/investor-hub/article/should-you-buy-these-3-stocks-before-presidential-election/,should you buy these  stocks before the us presidential election discover whether you should invest in these three stocks before the us presidential election analyzing potential impacts on the market and your portfolio,0.0,Neutral
NVDA,2024-09-30 05:55:21+00:00,Analyst predicts Nvidia (NVDA) stock to crash 50%; Here’s why - Finbold,"Analyst predicts Nvidia (NVDA) stock to crash 50%; Here’s why Finbold - Finance in Bold
Nvidia Stock: The Road To $200 Forbes
Nvidia stock's 20% drop is actually a good sign for the market, strategist says. Here's why Quartz
Nvidia Shares Are Trading Lower To…","Analyst predicts Nvidia (NVDA) stock to crash 50%; Heres why Finbold - Finance in BoldNvidia Stock: The Road To $200 ForbesNvidia stock's 20% drop is actually a good sign for the market, strategist s… [+134 chars]","{'id': None, 'name': 'Biztoc.com'}",https://biztoc.com/x/dbcc33fdce8d66b1,"analyst predicts nvidia nvda stock to crash  heres why  finbold analyst predicts nvidia nvda stock to crash  heres why finbold  finance in bold
nvidia stock the road to  forbes
nvidia stocks  drop is actually a good sign for the market strategist says heres why quartz
nvidia shares are trading lower to",0.5166666666666666,Positive
NVDA,2024-09-26 16:32:59+00:00,"Market Clubhouse Morning Memo - September 26th, 2024 (Trade Strategy For SPY, QQQ, AAPL, MSFT, NVDA, GOOGL, META And TSLA)","Good Morning Traders! In today's Market Clubhouse Morning Memo, we will discuss SPY, QQQ, AAPL, MSFT, NVDA, GOOGL, META, and TSLA.
Our proprietary formula, exclusive to Market Clubhouse, dictates these price levels. This dynamic equation takes into account pr…","Good Morning Traders! In today's Market Clubhouse Morning Memo, we will discuss SPY, QQQ, AAPL, MSFT, NVDA, GOOGL, META, and TSLA.Our proprietary formula, exclusive to Market Clubhouse, dictates thes… [+132 chars]","{'id': None, 'name': 'Biztoc.com'}",https://biztoc.com/x/6d3508733fe05dfd,"market clubhouse morning memo  september th  trade strategy for spy qqq aapl msft nvda googl meta and tsla good morning traders in todays market clubhouse morning memo we will discuss spy qqq aapl msft nvda googl meta and tsla
our proprietary formula exclusive to market clubhouse dictates these price levels this dynamic equation takes into account pr",0.35,Positive
NVDA,2024-09-17 14:28:09+00:00,"Market Clubhouse Morning Memo - September 17th, 2024 (Trade Strategy For SPY, QQQ, AAPL, MSFT, NVDA, GOOGL, META And TSLA)","Good Morning Traders! In today's Market Clubhouse Morning Memo, we will discuss SPY, QQQ, AAPL, MSFT, NVDA, GOOGL, META, and TSLA.
Our proprietary formula, exclusive to Market Clubhouse, dictates these price levels. This dynamic equation takes into account pr…","Good Morning Traders! In today's Market Clubhouse Morning Memo, we will discuss SPY, QQQ, AAPL, MSFT, NVDA, GOOGL, META, and TSLA.Our proprietary formula, exclusive to Market Clubhouse, dictates thes… [+132 chars]","{'id': None, 'name': 'Biztoc.com'}",https://biztoc.com/x/b352e0172af76865,"market clubhouse morning memo  september th  trade strategy for spy qqq aapl msft nvda googl meta and tsla good morning traders in todays market clubhouse morning memo we will discuss spy qqq aapl msft nvda googl meta and tsla
our proprietary formula exclusive to market clubhouse dictates these price levels this dynamic equation takes into account pr",0.35,Positive
NVDA,2024-09-12 15:14:40+00:00,"Market Clubhouse Morning Memo - September 12th, 2024 (Trade Strategy For SPY, QQQ, AAPL, MSFT, NVDA, GOOGL, META And TSLA)","Good Morning Traders! In today's Market Clubhouse Morning Memo, we will discuss SPY, QQQ, AAPL, MSFT, NVDA, GOOGL, META, and TSLA.
Our proprietary formula, exclusive to Market Clubhouse, dictates these price levels. This dynamic equation takes into account pr…","Good Morning Traders! In today's Market Clubhouse Morning Memo, we will discuss SPY, QQQ, AAPL, MSFT, NVDA, GOOGL, META, and TSLA.Our proprietary formula, exclusive to Market Clubhouse, dictates thes… [+132 chars]","{'id': None, 'name': 'Biztoc.com'}",https://biztoc.com/x/57af4c5c88f0ca04,"market clubhouse morning memo  september th  trade strategy for spy qqq aapl msft nvda googl meta and tsla good morning traders in todays market clubhouse morning memo we will discuss spy qqq aapl msft nvda googl meta and tsla
our proprietary formula exclusive to market clubhouse dictates these price levels this dynamic equation takes into account pr",0.35,Positive
NVDA,2024-09-23 18:37:35+00:00,Microsoft stock receives rare downgrade as analyst says it's 'beholden' to Nvidia,"received a rare Wall Street downgrade on Monday over concerns the tech giant's AI lead is diminishing while it has become too reliant on Nvidia (NVDA) for its artificial intelligence infrastructure.
Analysts at D.A. Davidson downgraded the stock to Neutral fr…",received a rare Wall Street downgrade on Monday over concerns the tech giant's AI lead is diminishing while it has become too reliant on Nvidia (NVDA) for its artificial intelligence infrastructure.A… [+130 chars],"{'id': None, 'name': 'Biztoc.com'}",https://biztoc.com/x/71c157a350cca924,"microsoft stock receives rare downgrade as analyst says its beholden to nvidia received a rare wall street downgrade on monday over concerns the tech giants ai lead is diminishing while it has become too reliant on nvidia nvda for its artificial intelligence infrastructure
analysts at da davidson downgraded the stock to neutral fr",0.0,Neutral
