ticker,date,title,description,content,source,url,cleaned_text,sentiment_score,sentiment_category
GOOGL,2024-09-08 05:20:53+00:00,Alphabet Inc. (GOOGL): Short Sellers Are Bullish On This Cloud Stock Now,"We recently compiled a list of the 10 Best Cloud Stocks To Buy According to Short Sellers. In this article, we are going to take a look at where Alphabet Inc...","We recently compiled a list of the 10 Best Cloud Stocks To Buy According to Short Sellers. In this article, we are going to take a look at where Alphabet Inc. (NASDAQ:GOOGL) stands against the other … [+10225 chars]","{'id': None, 'name': 'Yahoo Entertainment'}",https://finance.yahoo.com/news/alphabet-inc-googl-short-sellers-052053389.html,alphabet inc googl short sellers are bullish on this cloud stock now we recently compiled a list of the  best cloud stocks to buy according to short sellers in this article we are going to take a look at where alphabet inc,0.25,Positive
GOOGL,2024-09-08 01:18:18+00:00,Alphabet Inc. (GOOGL): Do Short Sellers Buy This Autonomous Driving Stock Now?,"We recently compiled a list of the 10 Best Autonomous Driving Stocks To Buy According To Short Sellers. In this article, we are going to take a look at where...","We recently compiled a list of the 10 Best Autonomous Driving Stocks To Buy According To Short Sellers. In this article, we are going to take a look at where Alphabet Inc. (NASDAQ:GOOGL) stands again… [+9740 chars]","{'id': None, 'name': 'Yahoo Entertainment'}",https://finance.yahoo.com/news/alphabet-inc-googl-short-sellers-011818426.html,alphabet inc googl do short sellers buy this autonomous driving stock now we recently compiled a list of the  best autonomous driving stocks to buy according to short sellers in this article we are going to take a look at where,0.3,Positive
GOOGL,2024-09-24 07:50:07+00:00,Alphabet Inc. (GOOGL): Why Are Street Analysts Bullish On This Wide Moat Stock Now?,"We recently compiled a list of the 8 Best Wide Moat Stocks to Buy According to Analysts. In this article, we are going to take a look at where Alphabet Inc. ...","We recently compiled a list of the 8 Best Wide Moat Stocks to Buy According to Analysts. In this article, we are going to take a look at where Alphabet Inc. (NASDAQ:GOOGL) stands against the other wi… [+8762 chars]","{'id': None, 'name': 'Yahoo Entertainment'}",https://finance.yahoo.com/news/alphabet-inc-googl-why-street-075007086.html/,alphabet inc googl why are street analysts bullish on this wide moat stock now we recently compiled a list of the  best wide moat stocks to buy according to analysts in this article we are going to take a look at where alphabet inc ,0.2,Positive
GOOGL,2024-09-27 07:11:49+00:00,Alphabet Inc. (GOOGL): Why Are Billionaires Bullish on This Stock Right Now?,,"If you click 'Accept all', we and our partners, including 240 who are part of the IAB Transparency &amp; Consent Framework, will also store and/or access information on a device (in other words, use … [+678 chars]","{'id': None, 'name': 'Yahoo Entertainment'}",https://consent.yahoo.com/v2/collectConsent?sessionId=1_cc-session_fbb25d02-9096-4dff-b605-5d1aadf832af,alphabet inc googl why are billionaires bullish on this stock right now ,0.2857142857142857,Positive
GOOGL,2024-09-20 15:19:15+00:00,"Tech Stocks Pull Back Friday, Hitting the Brakes on Fed-Fueled Rally","Tech stocks pulled back in early trading Friday, hitting the brakes on the market’s rally in the wake of the Federal Reserve’s supersized rate cut this week.","Key Takeaways
<ul><li>Tech stocks pulled back in early trading Friday after Thursdays rally helped propel major indexes to new highs in the wake of the Federal Reserves supersized rate cut.
</li><l… [+1778 chars]","{'id': None, 'name': 'Yahoo Entertainment'}",https://finance.yahoo.com/news/tech-stocks-pull-back-friday-151915986.html/,tech stocks pull back friday hitting the brakes on fedfueled rally tech stocks pulled back in early trading friday hitting the brakes on the markets rally in the wake of the federal reserves supersized rate cut this week,0.03333333333333333,Neutral
GOOGL,2024-09-23 18:24:59+00:00,Microsoft stock receives rare downgrade as analyst says it's 'beholden' to Nvidia,"Microsoft's AI lead is diminishing, and it is too reliant on Nvidia, say D.A Davidson analysts.",Microsoft (MSFT) received a rare Wall Street downgrade on Monday over concerns the tech giant's AI lead is diminishing while it has become too reliant on Nvidia (NVDA) for its artificial intelligence… [+2562 chars],"{'id': None, 'name': 'Yahoo Entertainment'}",https://finance.yahoo.com/news/microsoft-stock-receives-rare-downgrade-as-analyst-says-its-beholden-to-nvidia-182459634.html/,microsoft stock receives rare downgrade as analyst says its beholden to nvidia microsofts ai lead is diminishing and it is too reliant on nvidia say da davidson analysts,0.3,Positive
GOOGL,2024-09-16 21:04:33+00:00,Why Oracle Stock Jumped More Than 5% to a Record High on Monday,Oracle shares soared after analysts at Jefferies and Melius touted the software giant's strength in the cloud computing market.,"Key Takeaways
<ul><li>Oracle stock was one of the top performers in the S&amp;P 500 on Monday, jumping to an all-time high.
</li><li>The gains came as Jefferies analysts lifted their price target o… [+2275 chars]","{'id': None, 'name': 'Yahoo Entertainment'}",https://finance.yahoo.com/news/why-oracle-stock-jumped-more-210433565.html/,why oracle stock jumped more than  to a record high on monday oracle shares soared after analysts at jefferies and melius touted the software giants strength in the cloud computing market,0.33,Positive
GOOGL,2024-09-05 20:02:15+00:00,"Stock market today: Dow, S&P 500 continue September swoon ahead of pivotal jobs report",Labor data is in focus as the prospect of rate cuts fails to offset growing doubts about the health of the economy.,"Thursday night will serve as the kickoff to the 2024 NFL season.
It was only three years ago the NFL signed a media rights deal that welcomed Amazon Prime Video (AMZN) into the fold as the exclusive… [+3028 chars]","{'id': None, 'name': 'Yahoo Entertainment'}",https://finance.yahoo.com/news/live/stock-market-today-dow-sp-500-continue-september-swoon-ahead-of-pivotal-jobs-report-200215727.html/,stock market today dow sp  continue september swoon ahead of pivotal jobs report labor data is in focus as the prospect of rate cuts fails to offset growing doubts about the health of the economy,0.0,Neutral
GOOGL,2024-09-10 00:11:23+00:00,Here's the 'magical' moment Goldman Sachs sees for tech stocks,"Bring on lower interest rates and a faster pace of innovation, says one of Goldman's top tech analysts.","To get big tech stocks powering higher again, it will take the convergence of two factors, says Goldman Sachs' veteran tech analyst Kash Rangan.
The magic formula is a steady dose of interest rate c… [+3839 chars]","{'id': None, 'name': 'Yahoo Entertainment'}",https://finance.yahoo.com/news/heres-the-magical-moment-goldman-sachs-sees-for-tech-stocks-001123514.html,heres the magical moment goldman sachs sees for tech stocks bring on lower interest rates and a faster pace of innovation says one of goldmans top tech analysts,0.5,Positive
GOOGL,2024-09-12 20:24:01+00:00,"Analyst Says NVIDIA (NVDA) Will See ‘Dramatic’ Slowdown in Revenue, Demand Next Year","We recently published a list of Top 10 Trending AI Stocks Amid Latest News and Analyst Ratings. Since NVIDIA Corporation (NASDAQ:NVDA) ranks 4th on the list,...","We recently published a list of Top 10 Trending AI Stocks Amid Latest News and Analyst Ratings. Since NVIDIA Corporation (NASDAQ:NVDA) ranks 4th on the list, it deserves a deeper look.
The reality i… [+4762 chars]","{'id': None, 'name': 'Yahoo Entertainment'}",https://finance.yahoo.com/news/analyst-says-nvidia-nvda-see-202401359.html/,analyst says nvidia nvda will see dramatic slowdown in revenue demand next year we recently published a list of top  trending ai stocks amid latest news and analyst ratings since nvidia corporation nasdaqnvda ranks th on the list,0.11333333333333333,Positive
GOOGL,2024-09-14 08:15:00+00:00,Companies Doled Out $161.5 Billion to Their Investors Last Quarter. Here's How to Get Your Share of That Dividend Income.,There are lots of ways to collect some dividend income.,Companies are making lots of money these days. Many choose to return a portion of their profits to investors by paying dividends. American corporations paid out $161.5 billion in dividends during the… [+6184 chars],"{'id': None, 'name': 'Yahoo Entertainment'}",https://finance.yahoo.com/news/companies-doled-161-5-billion-081500685.html/,companies doled out  billion to their investors last quarter heres how to get your share of that dividend income there are lots of ways to collect some dividend income,0.0,Neutral
GOOGL,2024-09-17 09:06:00+00:00,Uh-Oh! Alphabet Is Selling Its Stake in 2 Historically High-Flying Artificial Intelligence (AI) Stocks,These once-sizable artificial intelligence (AI) holdings for Google parent Alphabet have been paired down big-time over the last two quarters.,"Five weeks ago, what can arguably be described as the most important data release of the third-quarter occurred -- and I'm not talking about the July inflation report.
No later than 45 calendar days… [+8467 chars]","{'id': None, 'name': 'Yahoo Entertainment'}",https://finance.yahoo.com/news/uh-oh-alphabet-selling-stake-090600133.html/,uhoh alphabet is selling its stake in  historically highflying artificial intelligence ai stocks these oncesizable artificial intelligence ai holdings for google parent alphabet have been paired down bigtime over the last two quarters,-0.27111111111111114,Negative
GOOGL,2024-09-27 08:26:00+00:00,Cathie Wood Says Software Is the Next Big AI Opportunity -- 1 Spectacular Stock You'll Regret Not Buying if She's Right,Software could be the next frontier for companies looking to make money from artificial intelligence.,"Cathie Wood is the head of Ark Investment Management, which operates a family of exchange-traded funds (ETFs) focused on innovative technology stocks. Last year, Wood said software companies could be… [+8200 chars]","{'id': None, 'name': 'Yahoo Entertainment'}",https://finance.yahoo.com/news/cathie-wood-says-software-next-082600252.html/,cathie wood says software is the next big ai opportunity   spectacular stock youll regret not buying if shes right software could be the next frontier for companies looking to make money from artificial intelligence,0.047619047619047616,Neutral
GOOGL,2024-09-06 21:30:23+00:00,Trade Overview: Where Gurus Found Value in the 2nd Quarter,GuruFocus portfolio data reveals what stocks investors liked in the first half of 2024,"With the latest round of 13F filings released over the past month, investors and market watchers alike are interested in seeing where the major hedge fund managers are finding value opportunities.
B… [+12589 chars]","{'id': None, 'name': 'Yahoo Entertainment'}",https://finance.yahoo.com/news/trade-overview-where-gurus-found-213023932.html,trade overview where gurus found value in the nd quarter gurufocus portfolio data reveals what stocks investors liked in the first half of ,0.22777777777777777,Positive
GOOGL,2024-09-17 12:21:06+00:00,What Investors Need To Know Ahead Of The Tesla Robotaxi Event,Tesla stock is above its 50-day moving average in the run-up to the Oct. 10 robotaxi event.,"Tesla (TSLA) is scheduled to reveal its highly anticipated robotaxi on Oct. 10 at an event in Los Angeles, California, and investors appear to be waiting until then before making any big Tesla stock … [+5659 chars]","{'id': None, 'name': ""Investor's Business Daily""}",https://www.investors.com/news/tesla-stock-elon-musk-robotaxi-event-investors-need-to-know/,what investors need to know ahead of the tesla robotaxi event tesla stock is above its day moving average in the runup to the oct  robotaxi event,-0.075,Negative
GOOGL,2024-09-19 15:55:03+00:00,The Fed's Interest-Rate Cut Is Lifting Magnificent 7 Stocks Today,"Tech stocks are jumping in the wake of Wednesday's rate cut by the Federal Reserve, with all of the Magnificent 7 stocks on the rise.","Key Takeaways
<ul><li>Tech stocks are jumping in the wake of Wednesday's rate cut by the Federal Reserve.
</li><li>All of the Magnificent Seven stocks are on the rise.
</li><li>Staples, utilities … [+1266 chars]","{'id': None, 'name': 'Yahoo Entertainment'}",https://finance.yahoo.com/news/feds-interest-rate-cut-lifting-155503894.html/,the feds interestrate cut is lifting magnificent  stocks today tech stocks are jumping in the wake of wednesdays rate cut by the federal reserve with all of the magnificent  stocks on the rise,1.0,Positive
GOOGL,2024-09-18 11:52:09+00:00,5 Things to Know Before the Stock Market Opens,"News of the day for September 18, 2024","News of the day for September 18, 2024
Samuel Corum / Bloomberg via Getty Images
Finally, it's Federal Reserve rate-cut day, with investors eagerly on watch for the size of the U.S.'s first cut in … [+3421 chars]","{'id': None, 'name': 'Yahoo Entertainment'}",https://finance.yahoo.com/news/5-things-know-stock-market-115209207.html/, things to know before the stock market opens news of the day for september  ,0.0,Neutral
GOOGL,2024-09-23 09:06:00+00:00,"Warren Buffett's Secret Portfolio Is Dumping Shares of 3 Supercharged Artificial Intelligence (AI) Stocks (No, Not Nvidia!)","The Oracle of Omaha's ""hidden"" $602 million portfolio has been a decisive seller of three brand-name companies on the cutting edge of the artificial...","Few if any money managers command the attention of professional and everyday investors quite like Berkshire Hathaway(NYSE: BRK.A)(NYSE: BRK.B) CEO Warren Buffett. Since becoming CEO in the mid-1960s,… [+8831 chars]","{'id': None, 'name': 'Yahoo Entertainment'}",https://finance.yahoo.com/news/warren-buffetts-secret-portfolio-dumping-090600860.html/,warren buffetts secret portfolio is dumping shares of  supercharged artificial intelligence ai stocks no not nvidia the oracle of omahas hidden  million portfolio has been a decisive seller of three brandname companies on the cutting edge of the artificial,-0.47333333333333333,Negative
GOOGL,2024-09-18 12:48:00+00:00,The unemployment measure you’ve never heard is flashing a recession warning,It may be a puzzle as to why the Fed is cutting at all when the economy is far from recession. One indicator suggests an answer.,"Happy Fed day, in what will be a momentous decision not just for the fact that it will herald the beginning of an interest rate-cutting cycle but for the uncertainty over the magnitude of the reducti… [+5452 chars]","{'id': None, 'name': 'Yahoo Entertainment'}",https://finance.yahoo.com/news/unemployment-measure-ve-never-heard-124800239.html/,the unemployment measure youve never heard is flashing a recession warning it may be a puzzle as to why the fed is cutting at all when the economy is far from recession one indicator suggests an answer,-0.25,Negative
GOOGL,2024-09-20 13:33:43+00:00,S&P 500 Nuclear Leader Inks 20-Year Microsoft Deal Spurring Three Mile Island Restart,Constellation Energy stock has jumped 78% in 2024.,S&amp;P 500 component Constellation Energy (CEG) announced Friday it plans to restart a Three Mile Island reactor after it signed a two-decade long contract with Microsoft (MSFT) to provide power for… [+5770 chars],"{'id': None, 'name': ""Investor's Business Daily""}",https://www.investors.com/news/sp-500-nuclear-inks-microsoft-deal-three-mile-island-restart/,sp  nuclear leader inks year microsoft deal spurring three mile island restart constellation energy stock has jumped  in ,0.0,Neutral
GOOGL,2024-09-19 09:35:00+00:00,Prediction: These 3 Stocks Won't Be Magnificent Buys in 5 Years,"If there's still a ""Magnificent Seven"" in five years, these stocks might not be among them.","The ""Magnificent Seven"" are a group of the world's most popular and promising growth stocks. Investing in these big-name tech stocks has been a great way to earn some significant returns in recent ye… [+5725 chars]","{'id': None, 'name': 'Yahoo Entertainment'}",https://finance.yahoo.com/news/prediction-3-stocks-wont-magnificent-093500677.html/,prediction these  stocks wont be magnificent buys in  years if theres still a magnificent seven in five years these stocks might not be among them,1.0,Positive
GOOGL,2024-09-23 12:17:00+00:00,Prediction: This Major Artificial Intelligence (AI) Stock Could Compete With Nvidia in the Not-Too-Distant Future,This Magnificant Seven company is making big moves.,What happens when a company's largest customers become fierce competitors? Imagine that you own the largest chocolate chip company in the land. You sell to all the largest grocery chains because you … [+5414 chars],"{'id': None, 'name': 'Yahoo Entertainment'}",https://finance.yahoo.com/news/prediction-major-artificial-intelligence-ai-121700305.html/,prediction this major artificial intelligence ai stock could compete with nvidia in the nottoodistant future this magnificant seven company is making big moves,-0.134375,Negative
AMZN,2024-09-11 14:50:00+00:00,Amazon is finally opening some Fresh supermarkets,"Amazon’s (AMZN) Fresh supermarkets, which have largely been dormant since their debut, are finally coming to life as the company ramps up its expansion of the discount grocery option.Read more...","In This Story
Amazons (AMZN) Fresh supermarkets, which have largely been dormant since their debut, are finally coming to life as the company ramps up its expansion of the discount grocery option.
… [+1969 chars]","{'id': None, 'name': 'Quartz India'}",https://qz.com/amazon-fresh-supermarket-openings-walmart-kroger-retail-1851645583,amazon is finally opening some fresh supermarkets amazons amzn fresh supermarkets which have largely been dormant since their debut are finally coming to life as the company ramps up its expansion of the discount grocery optionread more,0.21904761904761905,Positive
AMZN,2024-09-10 22:14:00+00:00,Oracle is drawing up plans to power a data center with nuclear reactors,"Computing giant Oracle (ORCL) unveiled quarterly earnings on Monday. Revenue was $13 billion, up 8% from a year ago; net income was $2.9 billion, up 23%. Though shares rose more than 11% after the report during Tuesday trading, the occasion revealed another e…","In This Story
Computing giant Oracle (ORCL) unveiled quarterly earnings on Monday. Revenue was $13 billion, up 8% from a year ago; net income was $2.9 billion, up 23%. Though shares rose more than 1… [+1845 chars]","{'id': None, 'name': 'Quartz India'}",https://qz.com/oracle-earnings-nuclear-reactors-1851645219,oracle is drawing up plans to power a data center with nuclear reactors computing giant oracle orcl unveiled quarterly earnings on monday revenue was  billion up  from a year ago net income was  billion up  though shares rose more than  after the report during tuesday trading the occasion revealed another e,0.2,Positive
AMZN,2024-09-16 21:25:00+00:00,Intel's stock is climbing — here's why,"Intel’s (INTC) stock hasn’t had the best year, but its shares closed on a high on Monday after news that it is eligible for more funding under the U.S. Chips and Science Act.Read more...","In This Story
Intels (INTC) stock hasnt had the best year, but its shares closed on a high on Monday after news that it is eligible for more funding under the U.S. Chips and Science Act.
The chipma… [+2538 chars]","{'id': None, 'name': 'Quartz India'}",https://qz.com/intel-stock-close-high-chips-act-department-defense-aws-1851649426,intels stock is climbing  heres why intels intc stock hasnt had the best year but its shares closed on a high on monday after news that it is eligible for more funding under the us chips and science actread more,0.41200000000000003,Positive
AMZN,2024-09-23 12:12:00+00:00,Intel is having a brutal year — but suddenly everybody wants a piece of it,Intel (INTC) is reportedly in talks for two multi-billion dollar deals — including a takeover — as the struggling chipmaker continues to draw interest from investors.Read more...,"In This Story
Intel (INTC) is reportedly in talks for two multi-billion dollar deals including a takeover as the struggling chipmaker continues to draw interest from investors.
Bloomberg, citing un… [+2217 chars]","{'id': None, 'name': 'Quartz India'}",https://qz.com/intel-qualcomm-apollo-nvidia-ai-chips-1851654625,intel is having a brutal year  but suddenly everybody wants a piece of it intel intc is reportedly in talks for two multibillion dollar deals  including a takeover  as the struggling chipmaker continues to draw interest from investorsread more,-0.04375000000000001,Neutral
AMZN,2024-09-10 22:11:55+00:00,Disney investors are glued to CEO succession outcome: Goldman Sachs analyst,Disney investors will be on the lookout for a new CEO within the next 12 months.,"Who lands the Disney (DIS) CEO gig after Bob Iger remains a hot-button issue with institutional investors.
""When I talk to investors, succession planning is incredibly important because it dictates … [+3555 chars]","{'id': None, 'name': 'Yahoo Entertainment'}",https://finance.yahoo.com/news/disney-investors-are-glued-to-ceo-succession-outcome-goldman-sachs-analyst-221155645.html,disney investors are glued to ceo succession outcome goldman sachs analyst disney investors will be on the lookout for a new ceo within the next  months,0.06818181818181818,Positive
AMZN,2024-09-10 19:58:44+00:00,Clash of the titans: Google and US attorneys kick off ad tech trial with clash over defining the market,"Are the technologies that power online advertising all part of one giant market, or are there distinct markets within the multibillion-dollar industry?
The...","Are the technologies that power online advertising all part of one giant market, or are there distinct markets within the multibillion-dollar industry?
The answer is critical to Google's defense in … [+7372 chars]","{'id': None, 'name': 'Yahoo Entertainment'}",https://finance.yahoo.com/news/clash-of-the-titans-google-and-us-attorneys-kick-off-ad-tech-trial-with-clash-over-defining-the-market-195844829.html,"clash of the titans google and us attorneys kick off ad tech trial with clash over defining the market are the technologies that power online advertising all part of one giant market or are there distinct markets within the multibilliondollar industry
the",0.15,Positive
AMZN,2024-09-26 18:50:34+00:00,Where Is Amazon's Stock Price Heading In 2025?,Interested in the outlook for Amazon stock? You’re not the only one. Here’s a look at key factors to get an idea of where Amazon stock may head throughout 2025.,"Copyright 2022 The Associated Press. All rights reserved
Where is Amazon's (AMZN) stock price heading next year? Let's formulate a prediction by running through the key factors, including the compan… [+10568 chars]","{'id': None, 'name': 'Forbes'}",https://www.forbes.com/sites/investor-hub/article/where-is-amazon-amzn-stock-price-heading-in-2025/,where is amazons stock price heading in  interested in the outlook for amazon stock youre not the only one heres a look at key factors to get an idea of where amazon stock may head throughout ,0.08333333333333333,Positive
AMZN,2024-09-29 11:00:00+00:00,Are Stocks Overvalued?,Expected Fed rate cuts and resilient economic growth sent stocks to all-time highs. Above-average stock valuation in light of fundamentals and the outlook are explored.,"With the backdrop of further expected Fed rate cuts, resilient economic growth, and stocks closing ... [+] at highs last week, are stocks overvalued?
getty
Chair Powell and the Federal Reserve rece… [+8294 chars]","{'id': None, 'name': 'Forbes'}",https://www.forbes.com/sites/bill_stone/2024/09/29/are-stocks-overvalued/,are stocks overvalued expected fed rate cuts and resilient economic growth sent stocks to alltime highs aboveaverage stock valuation in light of fundamentals and the outlook are explored,0.16666666666666666,Positive
AMZN,2024-09-19 12:00:00+00:00,"Forget Amazon, This Stock Has 85% Market Share And 2x Upside","There is a high probability that this run is unlikely to lose steam anytime soon, for this run is backed by solid business performance.","06 February 2024, Rhineland-Palatinate, Mainz: A police commissioner holds a Taser on the sidelines ... [+] of the presentation of the new police law in the courtyard of the Ministry of the Interior.… [+5471 chars]","{'id': None, 'name': 'Forbes'}",https://www.forbes.com/sites/greatspeculations/2024/09/19/forget-amazon-this-stock-has-85-market-share-and-2x-upside/,forget amazon this stock has  market share and x upside there is a high probability that this run is unlikely to lose steam anytime soon for this run is backed by solid business performance,-0.11333333333333333,Negative
AMZN,2024-10-01 14:10:00+00:00,Forget Tech Volatility: ‘Go Global’ With This Steady 8.1% Payer,"Closed-end funds (CEFs), with an average yield of around 8%, are terrific for just about any investor—especially those looking to their portfolios to help pay the bills.","Background of international currency notes.
getty
Closed-end funds (CEFs), with an average yield of around 8%, are terrific for just about any investorespecially those looking to their portfolios t… [+5448 chars]","{'id': None, 'name': 'Forbes'}",https://www.forbes.com/sites/michaelfoster/2024/10/01/forget-tech-volatility-go-global-with-this-steady-81-payer/,forget tech volatility go global with this steady  payer closedend funds cefs with an average yield of around  are terrific for just about any investorespecially those looking to their portfolios to help pay the bills,0.004166666666666666,Neutral
