ticker,date,title,description,content,source,url,cleaned_text,sentiment_score,sentiment_category
AAPL,2024-10-01 09:06:00+00:00,Prediction: 3 Market-Leading Stocks That May Plunge if Donald Trump Wins in November,A victory for the former president may bode poorly for a trio of industry-leading businesses.,"Exactly five weeks from today, on Nov. 5, voters from across the country will weigh in and decide which presidential nominee -- former President Donald Trump or current Vice President Kamala Harris -… [+8280 chars]","{'id': None, 'name': 'Yahoo Entertainment'}",https://finance.yahoo.com/news/prediction-3-market-leading-stocks-090600306.html/,prediction  marketleading stocks that may plunge if donald trump wins in november a victory for the former president may bode poorly for a trio of industryleading businesses,-0.03333333333333335,Neutral
AAPL,2024-09-12 20:00:34+00:00,"Stock market today: S&P 500, Nasdaq jump for 4th straight day as tech leads stocks higher",Wholesale inflation and jobless data set the stage for a Fed rate cut next week.,"US stocks jumped on Thursday as investors weighed fresh inflation and labor data against high-running expectations for a quarter-point interest-rate cut next week.
The S&amp;P 500 (^GSPC) rose 0.7% … [+8117 chars]","{'id': None, 'name': 'Yahoo Entertainment'}",https://finance.yahoo.com/news/live/stock-market-today-sp-500-nasdaq-jump-for-4th-straight-day-as-tech-leads-stocks-higher-200034896.html/,stock market today sp  nasdaq jump for th straight day as tech leads stocks higher wholesale inflation and jobless data set the stage for a fed rate cut next week,0.15,Positive
AAPL,2024-09-30 12:59:26+00:00,Was Brad Gerstner Wrong About Apple’s (AAPL) AI Potential?,"We recently published a list of Top 10 Favorite AI Stocks of Brad Gerstner. Since Apple Inc (NASDAQ:AAPL) ranks 10th on the list, it deserves a deeper look. ...","We recently published a list of Top 10 Favorite AI Stocks of Brad Gerstner. Since Apple Inc (NASDAQ:AAPL) ranks 10th on the list, it deserves a deeper look.
Brad Gerstner, the founder of Altimeter C… [+5232 chars]","{'id': None, 'name': 'Yahoo Entertainment'}",https://finance.yahoo.com/news/brad-gerstner-wrong-apple-aapl-125926424.html/,was brad gerstner wrong about apples aapl ai potential we recently published a list of top  favorite ai stocks of brad gerstner since apple inc nasdaqaapl ranks th on the list it deserves a deeper look ,0.1,Positive
MSFT,2024-09-25 02:18:10+00:00,Jim Cramer Reports That ‘Microsoft Corporation (MSFT) Is Joining BlackRock And Other Companies To Raise $100 Billion To Develop Data Centers For AI And The Energy Infrastructure To Power Them’,"We recently compiled a list of the Jim Cramer Reveals 12 Stocks Investors Should Monitor Closely. In this article, we are going to take a look at where...","We recently compiled a list of the Jim Cramer Reveals 12 Stocks Investors Should Monitor Closely. In this article, we are going to take a look at where Microsoft Corporation (NASDAQ:MSFT) stands agai… [+8306 chars]","{'id': None, 'name': 'Yahoo Entertainment'}",https://finance.yahoo.com/news/jim-cramer-reports-microsoft-corporation-021810723.html/,jim cramer reports that microsoft corporation msft is joining blackrock and other companies to raise  billion to develop data centers for ai and the energy infrastructure to power them we recently compiled a list of the jim cramer reveals  stocks investors should monitor closely in this article we are going to take a look at where,-0.0625,Negative
MSFT,2024-09-21 08:33:00+00:00,"Move Over, Nvidia: Billionaires Are Selling Its Shares and Buying Up These 2 Artificial Intelligence (AI) Stocks Instead",Many billionaires are shifting some of their AI investments toward Super Micro Computer and Microsoft.,"Wall Street has fallen in love with the artificial intelligence (AI) trend. This is not surprising, considering that PwC analysts expect AI to add nearly $15.7 trillion to the global economy annually… [+7436 chars]","{'id': None, 'name': 'Yahoo Entertainment'}",https://finance.yahoo.com/news/move-over-nvidia-billionaires-selling-083300873.html/,move over nvidia billionaires are selling its shares and buying up these  artificial intelligence ai stocks instead many billionaires are shifting some of their ai investments toward super micro computer and microsoft,0.07777777777777778,Positive
MSFT,2024-09-20 14:38:02+00:00,Jim Cramer Reports That ‘Microsoft Corporation (MSFT) Announced A 10% Increase In Its Quarterly Dividend And Approved A New $60 Billion Stock Buyback Program’,,"If you click 'Accept all', we and our partners, including 239 who are part of the IAB Transparency &amp; Consent Framework, will also store and/or access information on a device (in other words, use … [+678 chars]","{'id': None, 'name': 'Yahoo Entertainment'}",https://consent.yahoo.com/v2/collectConsent?sessionId=1_cc-session_553bf2f3-3749-4c58-a732-95649b021224,jim cramer reports that microsoft corporation msft announced a  increase in its quarterly dividend and approved a new  billion stock buyback program ,0.13636363636363635,Positive
MSFT,2024-09-10 22:14:00+00:00,Oracle is drawing up plans to power a data center with nuclear reactors,"Computing giant Oracle (ORCL) unveiled quarterly earnings on Monday. Revenue was $13 billion, up 8% from a year ago; net income was $2.9 billion, up 23%. Though shares rose more than 11% after the report during Tuesday trading, the occasion revealed another e…","In This Story
Computing giant Oracle (ORCL) unveiled quarterly earnings on Monday. Revenue was $13 billion, up 8% from a year ago; net income was $2.9 billion, up 23%. Though shares rose more than 1… [+1845 chars]","{'id': None, 'name': 'Quartz India'}",https://qz.com/oracle-earnings-nuclear-reactors-1851645219,oracle is drawing up plans to power a data center with nuclear reactors computing giant oracle orcl unveiled quarterly earnings on monday revenue was  billion up  from a year ago net income was  billion up  though shares rose more than  after the report during tuesday trading the occasion revealed another e,0.2,Positive
MSFT,2024-09-26 11:55:00+00:00,OpenAI is going for-profit — and giving Sam Altman equity,OpenAI is looking to attract investors by shedding its non-profit business model.Read more...,"In This Story
OpenAI is looking to attract investors by shedding its non-profit business model.
Reuters, citing sources familiar with the matter, reports that the ChatGPT-maker is reorganizing its … [+2092 chars]","{'id': None, 'name': 'Quartz India'}",https://qz.com/openai-sam-altman-for-profit-equity-murati-1851658091,openai is going forprofit  and giving sam altman equity openai is looking to attract investors by shedding its nonprofit business modelread more,0.5,Positive
MSFT,2024-09-16 13:00:00+00:00,"Nvidia, Microsoft, and other tech stocks could rally after the Fed cuts interest rates","With the Federal Reserve set to begin cutting interest rates this week, analysts believe tech stocks could get a big boost.Read more...","In This Story
With the Federal Reserve set to begin cutting interest rates this week, analysts believe tech stocks could get a big boost.
The start of a rate cutting cycle will be a positive signal… [+2363 chars]","{'id': None, 'name': 'Quartz India'}",https://qz.com/tech-stocks-nvidia-microsoft-ai-artificial-intelligence-1851648810,nvidia microsoft and other tech stocks could rally after the fed cuts interest rates with the federal reserve set to begin cutting interest rates this week analysts believe tech stocks could get a big boostread more,-0.056249999999999994,Negative
MSFT,2024-09-06 03:03:35+00:00,Prediction: Microsoft Azure To Reach $200 Billion In Revenue By 2028,"Microsoft Azure is predicted to more than double, spelling good things for MSFT stock. Azure's reporting metrics changed resulting in higher AI contribution and growth","BELLEVUE, WA - NOVEMBER 28: Microsoft CEO Satya Nadella smiles during the question and answer ... [+] portion of the Microsoft Annual Shareholders Meeting at the Meydenbauer Center on November 28, 20… [+22142 chars]","{'id': None, 'name': 'Forbes'}",https://www.forbes.com/sites/bethkindig/2024/09/05/prediction-microsoft-azure-to-reach-200-billion-in-revenue-by-2028/,prediction microsoft azure to reach  billion in revenue by  microsoft azure is predicted to more than double spelling good things for msft stock azures reporting metrics changed resulting in higher ai contribution and growth,0.3625,Positive
MSFT,2024-09-11 23:23:00+00:00,How To Buy AI Dividend Stocks Like My Mom,"The key for us dividend investors is to buy the bargain-priced AI plays best placed to bank this secure, growing revenue stream.","Large stack of money saving coupons.
getty
I recently had dinner with a friend whos a small business owner, and he swears by ChatGPT. The tool is saving him time, effort and (to be blunt) future em… [+5924 chars]","{'id': None, 'name': 'Forbes'}",https://www.forbes.com/sites/brettowens/2024/09/11/how-to-buy-ai-dividend-stocks-like-my-mom/,how to buy ai dividend stocks like my mom the key for us dividend investors is to buy the bargainpriced ai plays best placed to bank this secure growing revenue stream,0.4666666666666666,Positive
MSFT,2024-10-01 14:10:00+00:00,Forget Tech Volatility: ‘Go Global’ With This Steady 8.1% Payer,"Closed-end funds (CEFs), with an average yield of around 8%, are terrific for just about any investor—especially those looking to their portfolios to help pay the bills.","Background of international currency notes.
getty
Closed-end funds (CEFs), with an average yield of around 8%, are terrific for just about any investorespecially those looking to their portfolios t… [+5448 chars]","{'id': None, 'name': 'Forbes'}",https://www.forbes.com/sites/michaelfoster/2024/10/01/forget-tech-volatility-go-global-with-this-steady-81-payer/,forget tech volatility go global with this steady  payer closedend funds cefs with an average yield of around  are terrific for just about any investorespecially those looking to their portfolios to help pay the bills,0.004166666666666666,Neutral
MSFT,2024-09-29 11:00:00+00:00,Are Stocks Overvalued?,Expected Fed rate cuts and resilient economic growth sent stocks to all-time highs. Above-average stock valuation in light of fundamentals and the outlook are explored.,"With the backdrop of further expected Fed rate cuts, resilient economic growth, and stocks closing ... [+] at highs last week, are stocks overvalued?
getty
Chair Powell and the Federal Reserve rece… [+8294 chars]","{'id': None, 'name': 'Forbes'}",https://www.forbes.com/sites/bill_stone/2024/09/29/are-stocks-overvalued/,are stocks overvalued expected fed rate cuts and resilient economic growth sent stocks to alltime highs aboveaverage stock valuation in light of fundamentals and the outlook are explored,0.16666666666666666,Positive
MSFT,2024-09-25 19:31:05+00:00,Why Nvidia Stock Could Lag Behind A Key AI Energy Company,"CEG stock surged 22% on Sept. 20, driven by a 20-year deal with Microsoft to supply electricity from a restart (of undamaged) nuclear Unit 1 of Three Mile Island.","A sign announces the closing of the observation center for the Three Mile Island nuclear plant in ... [+] Pennsylvania, following an accident on March 28, 1979. A pump failed in the reactor cooling s… [+5502 chars]","{'id': None, 'name': 'Forbes'}",https://www.forbes.com/sites/petercohan/2024/09/25/why-nvidia-stock-could-lag-behind-a-key-ai-energy-company/,why nvidia stock could lag behind a key ai energy company ceg stock surged  on sept  driven by a year deal with microsoft to supply electricity from a restart of undamaged nuclear unit  of three mile island,-0.2,Negative
MSFT,2024-09-17 12:00:30+00:00,Monster Beverage Stock Vs. Keurig Dr Pepper,"There is more to the comparison, and in the sections below, we discuss why we think MNST will outperform KDP in the next three years.","Monster cans are seen at the airport in Balice near Krakow, Poland on May 18, 2024. (Photo by Jakub ... [+] Porzycki/NurPhoto via Getty Images)
NurPhoto via Getty Images
We believe that Monster Bev… [+5846 chars]","{'id': None, 'name': 'Forbes'}",https://www.forbes.com/sites/greatspeculations/2024/09/17/monster-beverage-stock-vs-keurig-dr-pepper/,monster beverage stock vs keurig dr pepper there is more to the comparison and in the sections below we discuss why we think mnst will outperform kdp in the next three years,0.25,Positive
MSFT,2024-09-11 21:11:15+00:00,5 Top Stocks To Buy In October,Looking for the latest stock opportunities in October 2024? We have you covered. Click to read about top stock picks to consider adding to your portfolio now.,"getty
As October approaches and the stock market unfolds its complexities and possibilities for investors, this article takes a look at stock picks in today's market scene based on financial perform… [+17276 chars]","{'id': None, 'name': 'Forbes'}",https://www.forbes.com/sites/investor-hub/article/best-stocks-buy-now-october-2024/, top stocks to buy in october looking for the latest stock opportunities in october  we have you covered click to read about top stock picks to consider adding to your portfolio now,0.5,Positive
MSFT,2024-09-13 10:00:46+00:00,Pfizer Stock Vs. AbbVie,"Although Pfizer has seen better revenue growth in recent years, AbbVie is more profitable.","Blister packets each containing a dose of PAXLOVID prescription medicine for a patient's Covid-19 ... [+] viral infection are arranged for a photo illustration on September 4, 2024 in Los Angeles, Ca… [+6451 chars]","{'id': None, 'name': 'Forbes'}",https://www.forbes.com/sites/greatspeculations/2024/09/13/is-pfizer-stock-a-better-pick-over-abbvie/,pfizer stock vs abbvie although pfizer has seen better revenue growth in recent years abbvie is more profitable,0.3333333333333333,Positive
MSFT,2024-09-10 13:30:15+00:00,Pick CSX Over Norfolk Southern Stock?,"Given its better valuation and prospects, we think CSX stock (NYSE: CSX) is a better pick than its peer – Norfolk Southern stock (NYSE: NSC).","ATLANTA, GA - APRIL 01: A general view of the exterior of the headquarters of Norfolk Southern on ... [+] April 1, 2023 in Atlanta, Georgia. The US Justice Department filed a civil lawsuit on March 3… [+6336 chars]","{'id': None, 'name': 'Forbes'}",https://www.forbes.com/sites/greatspeculations/2024/09/10/pick-csx-over-norfolk-southern-stock/,pick csx over norfolk southern stock given its better valuation and prospects we think csx stock nyse csx is a better pick than its peer  norfolk southern stock nyse nsc,0.25,Positive
MSFT,2024-09-17 11:00:07+00:00,Pick Disney Over Johnson & Johnson Stock,"There is more to the comparison, and in the sections below, we discuss why we think Disney will outperform J&J in the next three years.","CHINA - 2022/07/25: In this photo illustration, the American multinational medical devices and ... [+] pharmaceutical company Johnson &amp; Johnson (J&amp;J) logo is displayed on a smartphone screen.… [+7187 chars]","{'id': None, 'name': 'Forbes'}",https://www.forbes.com/sites/greatspeculations/2024/09/17/pick-disney-over-johnson--johnson-stock/,pick disney over johnson  johnson stock there is more to the comparison and in the sections below we discuss why we think disney will outperform jj in the next three years,0.25,Positive
MSFT,2024-09-26 11:00:19+00:00,Bristol Myers Squibb Vs. AbbVie Stock,"Given its better valuation, we believe that Bristol Myers Squibb stock (NYSE: BMY) is currently a better pick than its peer – AbbVie stock .","GERMANY - 2024/03/03: In this photo illustration, the Bristol-Myers Squibb Company logo is seen ... [+] displayed on a tablet. (Photo Illustration by Igor Golovniov/SOPA Images/LightRocket via Getty … [+6698 chars]","{'id': None, 'name': 'Forbes'}",https://www.forbes.com/sites/greatspeculations/2024/09/26/bristol-myers-squibb-vs-abbvie-stock/,bristol myers squibb vs abbvie stock given its better valuation we believe that bristol myers squibb stock nyse bmy is currently a better pick than its peer  abbvie stock ,0.5,Positive
MSFT,2024-09-10 10:30:21+00:00,nVidia vs. SMCI,"We compare a slew of factors, such as historical revenue growth, stock returns, and valuation.","SHANGHAI, CHINA - SEPTEMBER 5, 2024 - The NVIDIA pavilion at the Bund Conference in Shanghai, China, ... [+] September 5, 2024. (Photo credit should read CFOTO/Future Publishing via Getty Images)
CF… [+6663 chars]","{'id': None, 'name': 'Forbes'}",https://www.forbes.com/sites/greatspeculations/2024/09/10/nvidia-vs-smci/,nvidia vs smci we compare a slew of factors such as historical revenue growth stock returns and valuation,0.0,Neutral
MSFT,2024-09-17 14:24:00+00:00,The 3 Best Big Closed-End Funds Of 2024,Sometimes as income investors we face a situation that sounds like a good problem to have: We have to pick among a group of very impressive investments!,"Businessman analyzes the graph of trend market growth in 2024
getty
Sometimes as income investors we face a situation that sounds like a good problem to have: We have to pick among a group of very … [+5513 chars]","{'id': None, 'name': 'Forbes'}",https://www.forbes.com/sites/michaelfoster/2024/09/17/the-3-best-big-closed-end-funds-of-2024/,the  best big closedend funds of  sometimes as income investors we face a situation that sounds like a good problem to have we have to pick among a group of very impressive investments,0.675,Positive
MSFT,2024-09-13 15:28:34+00:00,Best 5 Stocks For Beginners With Little Money,Looking to begin investing on a limited budget? Here are stocks that could potentially be a good starting point for your investing journey.,"getty
Investing in the stock market can be an excellent way to grow your wealth over time, but it can seem daunting for beginners with limited funds. The stock market is a platform where shares of p… [+18498 chars]","{'id': None, 'name': 'Forbes'}",https://www.forbes.com/sites/investor-hub/article/stocks-for-beginners-with-little-money/,best  stocks for beginners with little money looking to begin investing on a limited budget here are stocks that could potentially be a good starting point for your investing journey,0.2882142857142857,Positive
MSFT,2024-09-06 18:38:34+00:00,My Secret Weapon For Calling The Top In NVDA,"While everyone else was cheering Nvidia’s (NVDA) stock back to new heights this week, I called the top for the stock first thing Monday August 26th.","August 9, 2019 Santa Clara / CA / USA - One of the Nvidia office buildings located in the Company's ... [+] campus in Silicon Valley; the NVIDIA logo and symbol displayed on the facade
getty
While … [+19921 chars]","{'id': None, 'name': 'Forbes'}",https://www.forbes.com/sites/greatspeculations/2024/09/06/my-secret-weapon-for-calling-the-top-in-nvda/,my secret weapon for calling the top in nvda while everyone else was cheering nvidias nvda stock back to new heights this week i called the top for the stock first thing monday august th,0.1643939393939394,Positive
MSFT,2024-09-26 16:32:59+00:00,"Market Clubhouse Morning Memo - September 26th, 2024 (Trade Strategy For SPY, QQQ, AAPL, MSFT, NVDA, GOOGL, META And TSLA)","Good Morning Traders! In today's Market Clubhouse Morning Memo, we will discuss SPY, QQQ, AAPL, MSFT, NVDA, GOOGL, META, and TSLA.
Our proprietary formula, exclusive to Market Clubhouse, dictates these price levels. This dynamic equation takes into account pr…","Good Morning Traders! In today's Market Clubhouse Morning Memo, we will discuss SPY, QQQ, AAPL, MSFT, NVDA, GOOGL, META, and TSLA.Our proprietary formula, exclusive to Market Clubhouse, dictates thes… [+132 chars]","{'id': None, 'name': 'Biztoc.com'}",https://biztoc.com/x/6d3508733fe05dfd,"market clubhouse morning memo  september th  trade strategy for spy qqq aapl msft nvda googl meta and tsla good morning traders in todays market clubhouse morning memo we will discuss spy qqq aapl msft nvda googl meta and tsla
our proprietary formula exclusive to market clubhouse dictates these price levels this dynamic equation takes into account pr",0.35,Positive
MSFT,2024-09-17 14:28:09+00:00,"Market Clubhouse Morning Memo - September 17th, 2024 (Trade Strategy For SPY, QQQ, AAPL, MSFT, NVDA, GOOGL, META And TSLA)","Good Morning Traders! In today's Market Clubhouse Morning Memo, we will discuss SPY, QQQ, AAPL, MSFT, NVDA, GOOGL, META, and TSLA.
Our proprietary formula, exclusive to Market Clubhouse, dictates these price levels. This dynamic equation takes into account pr…","Good Morning Traders! In today's Market Clubhouse Morning Memo, we will discuss SPY, QQQ, AAPL, MSFT, NVDA, GOOGL, META, and TSLA.Our proprietary formula, exclusive to Market Clubhouse, dictates thes… [+132 chars]","{'id': None, 'name': 'Biztoc.com'}",https://biztoc.com/x/b352e0172af76865,"market clubhouse morning memo  september th  trade strategy for spy qqq aapl msft nvda googl meta and tsla good morning traders in todays market clubhouse morning memo we will discuss spy qqq aapl msft nvda googl meta and tsla
our proprietary formula exclusive to market clubhouse dictates these price levels this dynamic equation takes into account pr",0.35,Positive
MSFT,2024-09-12 15:14:40+00:00,"Market Clubhouse Morning Memo - September 12th, 2024 (Trade Strategy For SPY, QQQ, AAPL, MSFT, NVDA, GOOGL, META And TSLA)","Good Morning Traders! In today's Market Clubhouse Morning Memo, we will discuss SPY, QQQ, AAPL, MSFT, NVDA, GOOGL, META, and TSLA.
Our proprietary formula, exclusive to Market Clubhouse, dictates these price levels. This dynamic equation takes into account pr…","Good Morning Traders! In today's Market Clubhouse Morning Memo, we will discuss SPY, QQQ, AAPL, MSFT, NVDA, GOOGL, META, and TSLA.Our proprietary formula, exclusive to Market Clubhouse, dictates thes… [+132 chars]","{'id': None, 'name': 'Biztoc.com'}",https://biztoc.com/x/57af4c5c88f0ca04,"market clubhouse morning memo  september th  trade strategy for spy qqq aapl msft nvda googl meta and tsla good morning traders in todays market clubhouse morning memo we will discuss spy qqq aapl msft nvda googl meta and tsla
our proprietary formula exclusive to market clubhouse dictates these price levels this dynamic equation takes into account pr",0.35,Positive
MSFT,2024-09-28 11:34:28+00:00,"My Favorite ""Magnificent Seven"" Stocks to Buy Now (Hint: Nvidia's Not One)","""Magnificent Seven"" stocks refers to a phrase coined by Bank of America analyst Michael Hartnett to describe the cohort leading the market. They are:
Apple (NASDAQ: AAPL)
Microsoft (NASDAQ: MSFT)
Nvidia (NASDAQ: NVDA)
Alphabet (NASDAQ: GOOG) (NASDAQ: GOOGL)
A…","""Magnificent Seven"" stocks refers to a phrase coined by Bank of America analyst Michael Hartnett to describe the cohort leading the market. They are:Apple (NASDAQ: AAPL)Microsoft (NASDAQ: MSFT)Nvidia… [+123 chars]","{'id': None, 'name': 'Biztoc.com'}",https://biztoc.com/x/5e8553c8020b8282,"my favorite magnificent seven stocks to buy now hint nvidias not one magnificent seven stocks refers to a phrase coined by bank of america analyst michael hartnett to describe the cohort leading the market they are
apple nasdaq aapl
microsoft nasdaq msft
nvidia nasdaq nvda
alphabet nasdaq goog nasdaq googl
a",0.8333333333333334,Positive
MSFT,2024-09-16 22:51:27+00:00,"Microsoft Announces $60 Billion Buyback, 10% Dividend Hike",The buyback is equal to less than 1.9% of the Dow titan's market cap.,"Microsoft (MSFT) announced late Monday that it will buy back up to $60 billion of its stock and hiked its quarterly dividend by 10%. MSFT stock edged higher overnight.
XNOW PLAYINGStocks Hit Pause B… [+1237 chars]","{'id': None, 'name': ""Investor's Business Daily""}",https://www.investors.com/news/technology/microsoft-60-billion-buyback-dividend-hike/,microsoft announces  billion buyback  dividend hike the buyback is equal to less than  of the dow titans market cap,-0.08333333333333333,Negative
MSFT,2024-09-17 11:00:18+00:00,Stock market today: Dow poised to build on record as US futures rise ahead of Fed,"Investors are looking to retail sales data for clues to consumer health, the last piece of data that could factor into the Fed's rate decision.","US stock futures rose on Tuesday, with techs leading the advance in the wait for fresh retail sales data and the start of a Federal Reserve meeting pivotal to an interest-rate cut.
Dow Jones Industr… [+1630 chars]","{'id': None, 'name': 'Yahoo Entertainment'}",https://finance.yahoo.com/news/live/stock-market-today-dow-poised-to-build-on-record-as-us-futures-rise-ahead-of-fed-110018250.html/,stock market today dow poised to build on record as us futures rise ahead of fed investors are looking to retail sales data for clues to consumer health the last piece of data that could factor into the feds rate decision,0.0,Neutral
MSFT,2024-09-19 13:07:24+00:00,"What's Going On With AI Related Stocks Nvidia, AMD, Broadcom And Super Micro On Thursday?","Semiconductor stocks especially the ones linked to artificial intelligence technology led by Nvidia Corp (NASDAQ:NVDA), Broadcom Inc (NASDAQ:AVGO), Advanced ...","Semiconductor stocks especially the ones linked to artificial intelligence technology led by Nvidia Corp (NASDAQ:NVDA), Broadcom Inc (NASDAQ:AVGO), Advanced Micro Devices, Inc (NASDAQ:AMD), Arm Holdi… [+2432 chars]","{'id': None, 'name': 'Yahoo Entertainment'}",https://finance.yahoo.com/news/whats-going-ai-related-stocks-130724617.html/,whats going on with ai related stocks nvidia amd broadcom and super micro on thursday semiconductor stocks especially the ones linked to artificial intelligence technology led by nvidia corp nasdaqnvda broadcom inc nasdaqavgo advanced ,0.026666666666666672,Neutral
